{
  "schema": "maat.content_sprint.v1",
  "record_id": "c3d4e5f6-a7b8-9012-cdef-123456789012",
  "created_at": "2026-06-26T16:00:00Z",
  "agent_id": "cursor_staydangerous",
  "timeline_source": "new local VLA model demo",
  "saw": "A desk robot demo that actually picks up a pen on first try.",
  "most_people_think": "Robotics hype — another demo that breaks in production.",
  "i_think_it_means": "Vision-language-action models are crossing from lab to boring desk tasks.",
  "heres_the_move": "Try one boring physical task, document every failure, ignore the hype cycle.",
  "draft_clip": {
    "hook": "Everyone showed you the robot catching the pen. Nobody showed you attempt 47.",
    "body": "The move is not the demo. It is the failure log.",
    "cta": "Pick one boring task. Ship the log.",
    "duration_seconds": 45
  },
  "external_publish": false,
  "tags": ["curator:7day", "topic:robotics"]
}
